{
  "version": "1.0",
  "language": "en",
  "duration_ms": 2400,
  "words": [
    { "text": "This", "start_ms": 0, "end_ms": 300, "confidence": 0.98 },
    { "text": "changes", "start_ms": 300, "end_ms": 700, "confidence": 0.95 },
    { "text": "everything", "start_ms": 700, "end_ms": 1200, "confidence": 0.97 },
    { "text": "watch", "start_ms": 1200, "end_ms": 1600, "confidence": 0.96 },
    { "text": "closely", "start_ms": 1600, "end_ms": 2400, "confidence": 0.94 }
  ]
}
